d3fend_id,d3fend_name,d3fend_tactic,description,digital_artifacts,counters_attack_ids,url,matrix
D3-SCA,System Call Analysis,Detect,Analyzing system calls to determine whether a process is exhibiting unauthorized behavior.,SystemCall,T1548.002|T1548.004|T1055.014|T1134.004|T1055.008|T1055.003|T1546.010|T1055.004|T1055.013|T1053|T1055.001|T1546.009|T1055.005|T1113|T1074.001|T1016|T1010|T1518.001|T1007|T1082|T1018|T1033|T1049|T1124|T1012|T1057|T1497.003|T1505.001|T1047|T1106|T1555.003|T1218.013|T1218.002|T1218.001|T1218.005|T1218.011|T1140|T1220|T1218.003|T1036.005,https://d3fend.mitre.org/technique/d3f:SystemCallAnalysis/,d3fend
D3-SCF,System Call Filtering,Isolate,Controlling access to local computer system resources with kernel-level capabilities.,,T1550|T1548.002|T1548.004|T1055.014|T1134.004|T1055.008|T1546.007|T1055.003|T1546.010|T1053.005|T1055.004|T1055.013|T1053|T1055.001|T1546.009|T1055.005|T1113|T1074.001|T1016|T1010|T1518.001|T1007|T1082|T1018|T1033|T1049|T1124|T1012|T1057|T1497.003|T1505.002|T1556|T1505.003|T1505.001|T1047|T1106|T1212|T1003.001|T1555.003|T1621|T1003.004|T1003.002|T1218.013|T1218.002|T1218.001|T1218.005|T1218.011|T1140|T1562.001|T1220|T1218.003|T1036.005,https://d3fend.mitre.org/technique/d3f:SystemCallFiltering/,d3fend
D3-SCH,Source Code Hardening,,Hardening source code with the intention of making it more difficult to exploit and less error prone.,Harden,,https://d3fend.mitre.org/technique/d3f:SourceCodeHardening/,d3fend
D3-SCP,System Configuration Permissions,Harden,Restricting system configuration modifications to a specific user or group of users.,,T1546.012|T1548.004|T1543.003|T1546.015|T1614.001|T1012|T1137.006|T1112|T1552.002|T1218.014|T1564.003|T1207|T1564.005,https://d3fend.mitre.org/technique/d3f:SystemConfigurationPermissions/,d3fend
D3-SDA,Session Duration Analysis,,Analyzing the duration of user sessions in order to detect unauthorized  activity.,Authentication|Authorization,,https://d3fend.mitre.org/technique/d3f:SessionDurationAnalysis/,d3fend
D3-SDM,System Daemon Monitoring,Detect,Tracking changes to the state or configuration of critical system level processes.,,T1053.005|T1053|T1562.001,https://d3fend.mitre.org/technique/d3f:SystemDaemonMonitoring/,d3fend
D3-SEA,Script Execution Analysis,,Analyzing the execution of a script to detect unauthorized user activity.,ScriptApplicationProcess,,https://d3fend.mitre.org/technique/d3f:ScriptExecutionAnalysis/,d3fend
D3-SFA,System File Analysis,Detect,"Monitoring system files such as authentication databases, configuration files, system logs, and system executables for modification or tampering.",OperatingSystemFile,T1055.009|T1548.003|T1574.006|T1543.002|T1018|T1556.003|T1003.007|T1070.002|T1036.003,https://d3fend.mitre.org/technique/d3f:SystemFileAnalysis/,d3fend
D3-SFCV,Stack Frame Canary Validation,Harden,Comparing a value stored in a stack frame with a known good value in order to prevent or detect a memory segment overwrite.,,T1210|T1068|T1203|T1212|T1211,https://d3fend.mitre.org/technique/d3f:StackFrameCanaryValidation/,d3fend
D3-SFV,System Firmware Verification,Detect,Cryptographically verifying installed system firmware integrity.,,T1542.004|T1542.001,https://d3fend.mitre.org/technique/d3f:SystemFirmwareVerification/,d3fend
D3-SHN,Standalone Honeynet,,An environment created for the purpose of attracting attackers and eliciting their behaviors that is not connected to any production enterprise systems.,,,https://d3fend.mitre.org/technique/d3f:StandaloneHoneynet/,d3fend
D3-SICA,System Init Config Analysis,Detect,Analysis of any system process startup configuration.,SystemInitConfiguration,T1037.005|T1574.011|T1547.001|T1037.004|T1562.009,https://d3fend.mitre.org/technique/d3f:SystemInitConfigAnalysis/,d3fend
D3-SJA,Scheduled Job Analysis,Detect,"Analysis of source files, processes, destination files, or destination servers associated with a scheduled job to detect unauthorized use of job scheduling.",JobSchedule,T1053|T1036.004,https://d3fend.mitre.org/technique/d3f:ScheduledJobAnalysis/,d3fend
D3-SMRA,Sender MTA Reputation Analysis,Detect,Characterizing the reputation of mail transfer agents (MTA) to determine the security risk in emails.,Email,T1534|T1114.001|T1566.001|T1566.002,https://d3fend.mitre.org/technique/d3f:SenderMTAReputationAnalysis/,d3fend
D3-SPP,Strong Password Policy,Harden,Modifying system configuration to increase password strength.,,T1110.001|T1110.003|T1110.002,https://d3fend.mitre.org/technique/d3f:StrongPasswordPolicy/,d3fend
D3-SRA,Sender Reputation Analysis,Detect,Ascertaining sender reputation based on information associated with a message (e.g. email/instant messaging).,Email,T1534|T1114.001|T1566.001|T1566.002,https://d3fend.mitre.org/technique/d3f:SenderReputationAnalysis/,d3fend
D3-SSC,Shadow Stack Comparisons,Detect,Comparing a call stack in system memory with a shadow call stack maintained by the processor to determine unauthorized shellcode activity.,StackFrame,T1210|T1068|T1203|T1212|T1211,https://d3fend.mitre.org/technique/d3f:ShadowStackComparisons/,d3fend
D3-ST,Session Termination,Evict,Forcefully end all active sessions associated with compromised accounts or devices.,,T1021.001|T1563|T1563.001|T1563.002|T1021.004|T1134.003|T1133|T1199,https://d3fend.mitre.org/technique/d3f:SessionTermination/,d3fend
D3-SU,Software Update,Harden,Replacing old software on a computer system component.,,T1072|T1547.008|T1546.011|T1574.010|T1574.005|T1490|T1056.003|T1497.003|T1505.004|T1542.003|T1137.006|T1542.004|T1176|T1505.001|T1554|T1542.001|T1542.002|T1195.001|T1195.002|T1212|T1649|T1218.014|T1564.006|T1127.001|T1014,https://d3fend.mitre.org/technique/d3f:SoftwareUpdate/,d3fend
D3-SVCDM,Service Dependency Mapping,,Service dependency mapping determines the services on which each given service relies.,,,https://d3fend.mitre.org/technique/d3f:ServiceDependencyMapping/,d3fend
D3-SWI,Software Inventory,Model,Software inventorying identifies and records the software items in the organization's architecture.,,T1072|T1547.008|T1546.011|T1574.010|T1574.005|T1490|T1056.003|T1497.003|T1505.004|T1542.003|T1137.006|T1542.004|T1176|T1505.001|T1554|T1542.001|T1542.002|T1195.001|T1195.002|T1212|T1649|T1218.014|T1564.006|T1127.001|T1014,https://d3fend.mitre.org/technique/d3f:SoftwareInventory/,d3fend
D3-SYSDM,System Dependency Mapping,,System dependency mapping identifies and models the dependencies of system components on each other to carry out their function.,,,https://d3fend.mitre.org/technique/d3f:SystemDependencyMapping/,d3fend
D3-SYSM,System Mapping,,"System mapping encompasses the techniques to identify the organization's systems, how they are configured and decomposed into subsystems and components, how they are dependent on one another, and where they are physically located.",Model,,https://d3fend.mitre.org/technique/d3f:SystemMapping/,d3fend
D3-SYSVA,System Vulnerability Assessment,Model,"System vulnerability assessment relates all the vulnerabilities of a system's components in the context of their configuration and internal dependencies and can also include assessing risk emerging from the system's design as a whole, not just the sum of individual component vulnerabilities.",,T1562.010,https://d3fend.mitre.org/technique/d3f:SystemVulnerabilityAssessment/,d3fend
D3-TAAN,Transfer Agent Authentication,,Validating that server components of a messaging infrastructure are authorized to send a particular message.,,,https://d3fend.mitre.org/technique/d3f:TransferAgentAuthentication/,d3fend
D3-TB,Token Binding,Harden,"Token binding is a security mechanism used to enhance the protection of tokens, such as cookies or OAuth tokens, by binding them to a specific connection.",,T1550.001|T1134.001|T1134.002|T1134.003|T1558.001|T1558|T1528,https://d3fend.mitre.org/technique/d3f:TokenBinding/,d3fend
D3-TBA,Token-based Authentication,Harden,"Token-based authentication is an authentication protocol where users verify their identity in exchange for a unique access token. Users can then access the website, application, or resource for the life of the token without having to re-enter their credentials.",,T1550.001|T1134.001|T1134.002|T1134.003|T1558.001|T1558|T1528,https://d3fend.mitre.org/technique/d3f:Token-basedAuthentication/,d3fend
D3-TBI,TPM Boot Integrity,,Assuring the integrity of a platform by demonstrating that the boot process starts from a trusted combination of hardware and software and continues until the operating system has fully booted and applications are running.  Sometimes called Static Root of Trust Measurement (STRM).,,,https://d3fend.mitre.org/technique/d3f:TPMBootIntegrity/,d3fend
D3-TL,Trusted Library,Harden,"A trusted library is a collection of pre-verified and secure code modules or components that are used within software applications to perform specific functions. These libraries are considered reliable and have been vetted for security vulnerabilities, ensuring they do not introduce risks into the application.",,T1505.001,https://d3fend.mitre.org/technique/d3f:TrustedLibrary/,d3fend
D3-UA,URL Analysis,Detect,Determining if a URL is benign or malicious by analyzing the URL or its components.,URL,T1566.002|T1566.003|T1189|T1204.001,https://d3fend.mitre.org/technique/d3f:URLAnalysis/,d3fend
D3-UAP,User Account Permissions,Isolate,Restricting a user account's access to resources.,,T1098.002|T1078.003|T1548.005|T1098|T1078|T1078.002|T1098.003|T1078.004|T1078.001|T1531|T1087.001|T1087.002|T1087.004|T1136|T1136.001|T1136.002|T1136.003,https://d3fend.mitre.org/technique/d3f:UserAccountPermissions/,d3fend
D3-UBA,User Behavior Analysis,,"User behavior analytics (""UBA"") as defined by Gartner, is a cybersecurity process about detection of insider threats, targeted attacks, and financial fraud. UBA solutions look at patterns of human behavior, and then apply algorithms and statistical analysis to detect meaningful anomalies from those patterns-anomalies that indicate potential threats.' Instead of tracking devices or security events, UBA tracks a system's users. Big data platforms are increasing UBA functionality by allowing them to analyze petabytes worth of data to detect insider threats and advanced persistent threats.",Detect,,https://d3fend.mitre.org/technique/d3f:UserBehaviorAnalysis/,d3fend
D3-UDTA,User Data Transfer Analysis,,Analyzing the amount of data transferred by a user.,ResourceAccess,,https://d3fend.mitre.org/technique/d3f:UserDataTransferAnalysis/,d3fend
D3-UGLPA,User Geolocation Logon Pattern Analysis,Detect,Monitoring geolocation data of user logon attempts and comparing it to a baseline user behavior profile to identify anomalies in logon location.,NetworkTraffic,T1021.001|T1550.001|T1210|T1021|T1563|T1550.004|T1021.004|T1570|T1098.001|T1546.008|T1546.003|T1219|T1573.001|T1090.004|T1090.001|T1001|T1104|T1008|T1132|T1573.002|T1071.004|T1568|T1205.001|T1071.001|T1102|T1095|T1071.003|T1090.003|T1071.002|T1105|T1573|T1205|T1071|T1572|T1571|T1090.002|T1498.002|T1499.002|T1498.001|T1565.002|T1557|T1557.001|T1185|T1557.003|T1018|T1542.005|T1197|T1566.001|T1190|T1566.002|T1199|T1189|T1204.001|T1047|T1110.004|T1110.003|T1003.006|T1558.003|T1207|T1218.003|T1567|T1020|T1048|T1030|T1029|T1048.001|T1041|T1567.002|T1048.003|T1011|T1048.002|T1567.001,https://d3fend.mitre.org/technique/d3f:UserGeolocationLogonPatternAnalysis/,d3fend
D3-ULA,Unlock Account,Restore,Restoring a user account's access to resources by unlocking a locked User Account.,,T1098.002|T1078.003|T1548.005|T1098|T1078|T1078.002|T1098.003|T1078.004|T1078.001|T1531|T1087.001|T1087.002|T1087.004|T1136|T1136.001|T1136.002|T1136.003,https://d3fend.mitre.org/technique/d3f:UnlockAccount/,d3fend
D3-URA,URL Reputation Analysis,Detect,Analyzing the reputation of a URL.,URL,T1566.002|T1566.003|T1189|T1204.001,https://d3fend.mitre.org/technique/d3f:URLReputationAnalysis/,d3fend
D3-USICA,User Session Init Config Analysis,Detect,Analyzing modifications to user session config files such as .bashrc or .bash_profile.,UserInitConfigurationFile,T1546.004|T1564.002,https://d3fend.mitre.org/technique/d3f:UserSessionInitConfigAnalysis/,d3fend
D3-VI,Variable Initialization,Harden,Setting variables to a known value before use.,,T1505.001,https://d3fend.mitre.org/technique/d3f:VariableInitialization/,d3fend
D3-VS,Video Surveillance,Detect,"Monitoring of physical areas via camera video feeds to deter, detect, and investigate unauthorized access and related security events.",,T1125,https://d3fend.mitre.org/technique/d3f:VideoSurveillance/,d3fend
D3-VTV,Variable Type Validation,,Ensuring that a variable has the correct type.,,,https://d3fend.mitre.org/technique/d3f:VariableTypeValidation/,d3fend
D3-WSAA,Web Session Activity Analysis,,Monitoring changes in user web session behavior by comparing current web session activity to a baseline behavior profile or a catalog of predetermined malicious behavior.,WebResourceAccess,,https://d3fend.mitre.org/technique/d3f:WebSessionActivityAnalysis/,d3fend
D3-WSAM,Web Session Access Mediation,Isolate,"Web session access mediation secures user sessions in web applications by employing robust authentication and integrity validation, along with adaptive threat mitigation techniques, to ensure that access to web resources is authorized and protected from session-related attacks.",,T1550|T1033|T1505.002|T1556|T1212|T1003.001|T1621|T1003.002,https://d3fend.mitre.org/technique/d3f:WebSessionAccessMediation/,d3fend
