d3fend_id,d3fend_name,d3fend_tactic,description,digital_artifacts,counters_attack_ids,url,matrix
D3-AA,Agent Authentication,Harden,Agent authentication is the process of verifying the identities of agents to ensure they are authorized and trustworthy participants within a system.,Harden,T1098.002|T1078.003|T1548.005|T1098|T1078|T1078.002|T1098.003|T1078.004|T1078.001|T1531|T1087.001|T1087.002|T1087.004|T1136|T1136.001|T1136.002|T1136.003,https://d3fend.mitre.org/technique/d3f:AgentAuthentication/,d3fend
D3-ABPI,Application-based Process Isolation,Isolate,Application code which prevents its own subroutines from accessing intra-process / internal memory space.,,T1550|T1546.007|T1053.005|T1053|T1033|T1505.002|T1556|T1505.003|T1505.001|T1212|T1003.001|T1621|T1003.004|T1003.002|T1562.001,https://d3fend.mitre.org/technique/d3f:Application-basedProcessIsolation/,d3fend
D3-ACA,Active Certificate Analysis,,Actively collecting PKI certificates by connecting to the server and downloading its server certificates for analysis.,,,https://d3fend.mitre.org/technique/d3f:ActiveCertificateAnalysis/,d3fend
D3-ACH,Application Configuration Hardening,Harden,Modifying an application's configuration to reduce its attack surface.,,T1114.003|T1562.003|T1564.008|T1562.002,https://d3fend.mitre.org/technique/d3f:ApplicationConfigurationHardening/,d3fend
D3-AEM,Application Exception Monitoring,Detect,Monitoring the failures of system counters and timers.,,T1134.002|T1548.003|T1134.003|T1546.005|T1546.003|T1110.001|T1110.004|T1003.005|T1187|T1110.003|T1003.006|T1070.001|T1140|T1070.003,https://d3fend.mitre.org/technique/d3f:ApplicationExceptionMonitoring/,d3fend
D3-AH,Application Hardening,,Application Hardening makes an executable application more resilient to a class of exploits which either introduce new code or execute unwanted existing code. These techniques may be applied at compile-time or on an application binary.,Harden,,https://d3fend.mitre.org/technique/d3f:ApplicationHardening/,d3fend
D3-AI,Asset Inventory,,Asset inventorying identifies and records the organization's assets and enriches each inventory item with knowledge about their vulnerabilities.,Model,,https://d3fend.mitre.org/technique/d3f:AssetInventory/,d3fend
D3-AL,Account Locking,Evict,The process of temporarily disabling user accounts on a system or domain.,,T1098.002|T1078.003|T1548.005|T1098|T1078|T1078.002|T1098.003|T1078.004|T1078.001|T1531|T1087.001|T1087.002|T1087.004|T1136|T1136.001|T1136.002|T1136.003,https://d3fend.mitre.org/technique/d3f:AccountLocking/,d3fend
D3-ALLM,Active Logical Link Mapping,,"Active logical link mapping sends and receives network traffic as a means to map the whole data link layer, where the links represent logical data flows rather than physical connection",,,https://d3fend.mitre.org/technique/d3f:ActiveLogicalLinkMapping/,d3fend
D3-AM,Access Modeling,Model,"Access modeling captures and records the access permissions granted to identities (e.g., administrators, users, groups, systems) and optionally includes details on how these identities are stored, managed, and shared across systems.",,T1098.002|T1078.003|T1548.001|T1134.005|T1548.005|T1098|T1078|T1078.002|T1098.003|T1484|T1078.004|T1078.001|T1531|T1087.001|T1087.002|T1087.004|T1615|T1136|T1136.001|T1136.002|T1556.009|T1136.003|T1552.006|T1222,https://d3fend.mitre.org/technique/d3f:AccessModeling/,d3fend
D3-AMED,Access Mediation,,"Access mediation is the process of granting or denying specific requests to: 1) obtain and use information and related information processing services; and 2) enter specific physical facilities (e.g., Federal buildings, military establishments, border crossing entrances). Access mediation decisions should enforce least privilege by granting access for scoped durations to prevent privilege creep and, where applicable, implement just-in-time (JIT) access. Denial decisions may prevent initial access or terminate access that has already been granted, ensuring continuous enforcement of security policies.",Isolate,,https://d3fend.mitre.org/technique/d3f:AccessMediation/,d3fend
D3-ANAA,Administrative Network Activity Analysis,Detect,Detection of unauthorized use of administrative network protocols by analyzing network activity against a baseline.,IntranetAdministrativeNetworkTraffic,T1098.001|T1546.008|T1546.003|T1047|T1110.004|T1110.003|T1003.006|T1207,https://d3fend.mitre.org/technique/d3f:AdministrativeNetworkActivityAnalysis/,d3fend
D3-ANCI,Authentication Cache Invalidation,Evict,Removing tokens or credentials from an authentication cache to prevent further user associated account accesses.,,T1550.001|T1550.004|T1134.001|T1098.001|T1134.002|T1134.003|T1110.001|T1003.003|T1558.001|T1558|T1003.008|T1528|T1003.005|T1110.003|T1539|T1142|T1552|T1110.002|T1606|T1606.001,https://d3fend.mitre.org/technique/d3f:AuthenticationCacheInvalidation/,d3fend
D3-ANET,Authentication Event Thresholding,,"Collecting authentication events, creating a baseline user profile, and determining whether authentication events are consistent with the baseline profile.",Authentication,,https://d3fend.mitre.org/technique/d3f:AuthenticationEventThresholding/,d3fend
D3-APA,Access Policy Administration,,"Access policy administration is the systematic process of defining, implementing, and managing access control policies that dictate user permissions to resources.",Isolate,,https://d3fend.mitre.org/technique/d3f:AccessPolicyAdministration/,d3fend
D3-APCA,Application Protocol Command Analysis,Detect,Analyzing application protocol level remote commands to detect unauthorized activity.,,T1021.001|T1550.001|T1210|T1021|T1563|T1550.004|T1021.004|T1570|T1098.001|T1546.008|T1546.003|T1219|T1573.001|T1090.004|T1090.001|T1001|T1104|T1008|T1132|T1573.002|T1071.004|T1568|T1205.001|T1071.001|T1102|T1095|T1071.003|T1090.003|T1071.002|T1105|T1573|T1205|T1071|T1572|T1571|T1090.002|T1498.002|T1499.002|T1498.001|T1565.002|T1557|T1557.001|T1185|T1557.003|T1018|T1542.005|T1197|T1566.001|T1190|T1566.002|T1199|T1189|T1204.001|T1047|T1110.004|T1110.003|T1003.006|T1558.003|T1207|T1218.003|T1567|T1020|T1048|T1030|T1029|T1048.001|T1041|T1567.002|T1048.003|T1011|T1048.002|T1567.001,https://d3fend.mitre.org/technique/d3f:ApplicationProtocolCommandAnalysis/,d3fend
D3-APLM,Active Physical Link Mapping,,Active physical link mapping sends and receives network traffic as a means to map the physical layer.,,,https://d3fend.mitre.org/technique/d3f:ActivePhysicalLinkMapping/,d3fend
D3-APM,Application Performance Monitoring,,Monitoring the count and duration of the application or program cycle.,,,https://d3fend.mitre.org/technique/d3f:ApplicationPerformanceMonitoring/,d3fend
D3-ARMA,ARMA Model,,"Autoregressive-moving-average (ARMA) models provide a parsimonious description of a (weakly) stationary stochastic process in terms of two polynomials, one for the autoregression (AR) and the second for the moving average (MA).",,,https://d3fend.mitre.org/technique/d3f:ARMA_Model/,d3fend
D3-AVE,Asset Vulnerability Enumeration,Model,Asset vulnerability enumeration enriches inventory items with knowledge identifying their vulnerabilities.,,T1072|T1547.008|T1546.011|T1574.010|T1574.005|T1490|T1056.003|T1497.003|T1505.004|T1542.003|T1137.006|T1542.004|T1176|T1505.001|T1554|T1542.001|T1542.002|T1195.001|T1195.002|T1212|T1649|T1218.014|T1564.006|T1127.001|T1014,https://d3fend.mitre.org/technique/d3f:AssetVulnerabilityEnumeration/,d3fend
D3-AZET,Authorization Event Thresholding,,"Collecting authorization events, creating a baseline user profile, and determining whether authorization events are consistent with the baseline profile.",Authorization,,https://d3fend.mitre.org/technique/d3f:AuthorizationEventThresholding/,d3fend
D3-BA,Bootloader Authentication,Harden,Cryptographically authenticating the bootloader software before system boot.,,T1542.003,https://d3fend.mitre.org/technique/d3f:BootloaderAuthentication/,d3fend
D3-BAN,Biometric Authentication,,Using biological measures in order to authenticate a user.,,,https://d3fend.mitre.org/technique/d3f:BiometricAuthentication/,d3fend
D3-BDI,Broadcast Domain Isolation,,Broadcast isolation restricts the number of computers a host can contact on their LAN.,,,https://d3fend.mitre.org/technique/d3f:BroadcastDomainIsolation/,d3fend
D3-BMA,Bus Message Authentication,,Applies cryptographic primitives to individual bus frames to verify the sender's identity and ensure the integrity of the data payload.,,,https://d3fend.mitre.org/technique/d3f:BusMessageAuthentication/,d3fend
D3-BSE,Byte Sequence Emulation,,Analyzing sequences of bytes and determining if they likely represent malicious shellcode.,,,https://d3fend.mitre.org/technique/d3f:ByteSequenceEmulation/,d3fend
D3-CA,Certificate Analysis,Detect,"Analyzing Public Key Infrastructure certificates to detect if they have been misconfigured or spoofed using both network traffic, certificate fields and third-party logs.",CertificateFile,T1573.002|T1071.001|T1071|T1649|T1041|T1048.002,https://d3fend.mitre.org/technique/d3f:CertificateAnalysis/,d3fend
D3-CAA,Connection Attempt Analysis,Detect,Analyzing failed connections in a network to detect unauthorized activity.,IntranetNetworkTraffic,T1210|T1021|T1570|T1098.001|T1546.008|T1546.003|T1090.001|T1557.001|T1197|T1199|T1047|T1110.004|T1110.003|T1003.006|T1207,https://d3fend.mitre.org/technique/d3f:ConnectionAttemptAnalysis/,d3fend
D3-CBAN,Certificate-based Authentication,Harden,Requiring a digital certificate in order to authenticate a user.,,T1649,https://d3fend.mitre.org/technique/d3f:Certificate-basedAuthentication/,d3fend
D3-CCSA,Credential Compromise Scope Analysis,Detect,Determining which credentials may have been compromised by analyzing the user logon history of a particular system.,Credential,T1550.001|T1550.004|T1134.001|T1098.001|T1134.002|T1134.003|T1110.001|T1003.003|T1558.001|T1558|T1003.008|T1528|T1003.005|T1110.003|T1539|T1142|T1552|T1110.002|T1606|T1606.001,https://d3fend.mitre.org/technique/d3f:CredentialCompromiseScopeAnalysis/,d3fend
D3-CDP,Change Default Password,Harden,"Changing the default password means replacing the factory-set credentials with a strong, unique password before the device is deployed, preventing unauthorized access.",,T1098.002|T1078.003|T1548.005|T1098|T1078|T1078.002|T1098.003|T1078.004|T1078.001|T1531|T1087.001|T1087.002|T1087.004|T1136|T1136.001|T1136.002|T1136.003|T1110.001|T1110.003|T1110.002,https://d3fend.mitre.org/technique/d3f:ChangeDefaultPassword/,d3fend
D3-CE,Credential Eviction,,Credential Eviction techniques disable or remove compromised credentials from a computer network.,Evict,,https://d3fend.mitre.org/technique/d3f:CredentialEviction/,d3fend
D3-CERO,Certificate Rotation,Harden,"Certificate rotation involves replacing digital certificates and their private keys to maintain cryptographic integrity and trust, mitigating key compromise risks and ensuring continuous secure communications.",,T1649,https://d3fend.mitre.org/technique/d3f:CertificateRotation/,d3fend
D3-CF,Content Filtering,Isolate,Content Filtering techniques aid in the process of analyzing an input file for malicious or erroneous content and outputing a sanitized version.,Isolate,T1072|T1534|T1548.002|T1055.014|T1547.006|T1546.004|T1546.002|T1574.002|T1055.003|T1547.007|T1546.015|T1574.004|T1546.010|T1543.004|T1574.012|T1053.004|T1055.002|T1574.009|T1547.011|T1546.014|T1547.009|T1547.001|T1546.006|T1547.008|T1546.008|T1055.009|T1574.001|T1037.004|T1037.002|T1574.007|T1037.003|T1548.003|T1543.001|T1546.013|T1055.001|T1546.005|T1037.001|T1574.006|T1546.009|T1574.008|T1543.002|T1573.002|T1071.001|T1071|T1486|T1565.001|T1565.003|T1119|T1074.001|T1560.003|T1005|T1560|T1560.002|T1560.001|T1114.001|T1016|T1018|T1033|T1083|T1137.001|T1556.002|T1505.003|T1137.003|T1556.003|T1566.001|T1566.002|T1566.003|T1204.002|T1059|T1552.001|T1003.008|T1187|T1555|T1555.003|T1003.007|T1649|T1552.003|T1070.002|T1036.006|T1218.005|T1027.004|T1564.006|T1127.001|T1027.002|T1218.011|T1564.003|T1140|T1014|T1562.003|T1036.001|T1220|T1070.004|T1036.003|T1036.005|T1027.001|T1564.007|T1564.002|T1041|T1048.002,https://d3fend.mitre.org/technique/d3f:ContentFiltering/,d3fend
D3-CFC,Content Format Conversion,,Content format conversion is mechanical transformation from one format to another which may be normalization or specifically flattening.,,,https://d3fend.mitre.org/technique/d3f:ContentFormatConversion/,d3fend
D3-CFI,Control Flow Integrity,,Enforcing legal control flow transfers during application process execution.,,,https://d3fend.mitre.org/technique/d3f:ControlFlowIntegrity/,d3fend
D3-CH,Credential Hardening,Harden,Credential Hardening techniques modify system or network properties in order to protect system or network/domain credentials.,Harden,T1550.001|T1550.004|T1134.001|T1098.001|T1134.002|T1134.003|T1110.001|T1003.003|T1558.001|T1558|T1003.008|T1528|T1003.005|T1110.003|T1539|T1142|T1552|T1110.002|T1606|T1606.001,https://d3fend.mitre.org/technique/d3f:CredentialHardening/,d3fend
D3-CHN,Connected Honeynet,,"A decoy service, system, or environment, that is connected to the enterprise network, and simulates or emulates certain functionality to the network, without exposing full access to a production system.",,,https://d3fend.mitre.org/technique/d3f:ConnectedHoneynet/,d3fend
D3-CI,Configuration Inventory,Model,Configuration inventory identifies and records the configuration of software and hardware and their components throughout the organization.,,T1548.002|T1547.003|T1548.001|T1134.005|T1548.005|T1037.005|T1546.002|T1546.007|T1547.002|T1546.010|T1574.012|T1546.001|T1574.011|T1546.014|T1547.001|T1547.010|T1547.005|T1546.008|T1037.004|T1484|T1546.011|T1547.004|T1546.009|T1490|T1114.003|T1538|T1614|T1518.001|T1526|T1615|T1137.004|T1137.001|T1556.002|T1556.009|T1137.005|T1137.002|T1552.005|T1552.006|T1218.002|T1562.007|T1578.002|T1562.004|T1666|T1562.003|T1564.008|T1222|T1578.003|T1553.003|T1562.008|T1578.004|T1578.005|T1562.009|T1562.002,https://d3fend.mitre.org/technique/d3f:ConfigurationInventory/,d3fend
D3-CIA,Container Image Analysis,Model,Analyzing a Container Image with respect to a set of policies.,ContainerImage,T1525,https://d3fend.mitre.org/technique/d3f:ContainerImageAnalysis/,d3fend
D3-CM,Content Modification,Isolate,Modify content that does not comply with policy.,,T1072|T1534|T1548.002|T1055.014|T1547.006|T1546.004|T1546.002|T1574.002|T1055.003|T1547.007|T1546.015|T1574.004|T1546.010|T1543.004|T1574.012|T1053.004|T1055.002|T1574.009|T1547.011|T1546.014|T1547.009|T1547.001|T1546.006|T1547.008|T1546.008|T1055.009|T1574.001|T1037.004|T1037.002|T1574.007|T1037.003|T1548.003|T1543.001|T1546.013|T1055.001|T1546.005|T1037.001|T1574.006|T1546.009|T1574.008|T1543.002|T1573.002|T1071.001|T1071|T1486|T1565.001|T1565.003|T1119|T1074.001|T1560.003|T1005|T1560|T1560.002|T1560.001|T1114.001|T1016|T1018|T1033|T1083|T1137.001|T1556.002|T1505.003|T1137.003|T1556.003|T1566.001|T1566.002|T1566.003|T1204.002|T1059|T1552.001|T1003.008|T1187|T1555|T1555.003|T1003.007|T1649|T1552.003|T1070.002|T1036.006|T1218.005|T1027.004|T1564.006|T1127.001|T1027.002|T1218.011|T1564.003|T1140|T1014|T1562.003|T1036.001|T1220|T1070.004|T1036.003|T1036.005|T1027.001|T1564.007|T1564.002|T1041|T1048.002,https://d3fend.mitre.org/technique/d3f:ContentModification/,d3fend
D3-CNE,Content Excision,,"Removing specific, potentially malicious, parts of content",,,https://d3fend.mitre.org/technique/d3f:ContentExcision/,d3fend
D3-CNR,Content Rebuild,,Rebuild the file according to the spec so any unreferenced components or objects are removed.,,,https://d3fend.mitre.org/technique/d3f:ContentRebuild/,d3fend
D3-CNS,Content Substitution,,Modifies specific digital content information by replacing it with something else.,,,https://d3fend.mitre.org/technique/d3f:ContentSubstitution/,d3fend
D3-CP,Certificate Pinning,Harden,Persisting either a server's X.509 certificate or their public key and comparing that to server's presented identity to allow for greater client confidence in the remote server's identity for SSL connections.,,T1649,https://d3fend.mitre.org/technique/d3f:CertificatePinning/,d3fend
D3-CQ,Content Quarantine,Isolate,Transfer content that does not comply with policy to a quarantine zone.,,T1072|T1534|T1548.002|T1055.014|T1547.003|T1547.006|T1546.004|T1546.002|T1546.007|T1574.002|T1055.003|T1547.002|T1547.007|T1546.015|T1574.004|T1546.010|T1543.004|T1574.012|T1546.001|T1053.004|T1574.011|T1055.002|T1574.009|T1547.011|T1546.014|T1547.009|T1547.001|T1546.006|T1547.010|T1547.008|T1547.005|T1546.008|T1055.009|T1574.001|T1037.004|T1037.002|T1574.007|T1037.003|T1548.003|T1543.001|T1546.013|T1055.001|T1546.005|T1037.001|T1547.004|T1574.006|T1546.009|T1574.008|T1543.002|T1573.002|T1071.001|T1071|T1486|T1565.001|T1565.003|T1119|T1074.001|T1560.003|T1005|T1560|T1560.002|T1560.001|T1114.001|T1016|T1518.001|T1018|T1033|T1083|T1137.001|T1556.002|T1137.002|T1505.003|T1137.003|T1556.003|T1566.001|T1566.002|T1566.003|T1204.002|T1059|T1552.001|T1003.008|T1187|T1555|T1555.003|T1003.007|T1649|T1552.003|T1070.002|T1036.006|T1218.002|T1218.005|T1027.004|T1564.006|T1127.001|T1027.002|T1218.011|T1564.003|T1140|T1014|T1562.003|T1036.001|T1553.003|T1220|T1070.004|T1036.003|T1036.005|T1027.001|T1562.009|T1564.007|T1564.002|T1041|T1048.002,https://d3fend.mitre.org/technique/d3f:ContentQuarantine/,d3fend
D3-CR,Credential Revocation,Evict,Deleting a set of credentials permanently to prevent them from being used to authenticate.,,T1550.001|T1550.004|T1134.001|T1098.001|T1134.002|T1134.003|T1110.001|T1003.003|T1558.001|T1558|T1003.008|T1528|T1003.005|T1110.003|T1539|T1142|T1552|T1110.002|T1606|T1606.001,https://d3fend.mitre.org/technique/d3f:CredentialRevocation/,d3fend
D3-CRO,Credential Rotation,Harden,"Credential rotation is a security procedure in which authentication credentials, such as passwords, API keys, or certificates, are regularly changed or replaced to minimize the risk of unauthorized access.",,T1550.001|T1550.004|T1134.001|T1098.001|T1134.002|T1134.003|T1110.001|T1003.003|T1558.001|T1558|T1003.008|T1528|T1003.005|T1110.003|T1539|T1142|T1552|T1110.002|T1606|T1606.001,https://d3fend.mitre.org/technique/d3f:CredentialRotation/,d3fend
D3-CS,Credential Scrubbing,Harden,The systematic removal of hard-coded credentials from source code to prevent accidental exposure and unauthorized access.,,T1505.001,https://d3fend.mitre.org/technique/d3f:CredentialScrubbing/,d3fend
D3-CSPP,Client-server Payload Profiling,Detect,Comparing client-server request and response payloads to a baseline profile to identify outliers.,NetworkTraffic,T1021.001|T1550.001|T1210|T1021|T1563|T1550.004|T1021.004|T1570|T1098.001|T1546.008|T1546.003|T1219|T1573.001|T1090.004|T1090.001|T1001|T1104|T1008|T1132|T1573.002|T1071.004|T1568|T1205.001|T1071.001|T1102|T1095|T1071.003|T1090.003|T1071.002|T1105|T1573|T1205|T1071|T1572|T1571|T1090.002|T1498.002|T1499.002|T1498.001|T1565.002|T1557|T1557.001|T1185|T1557.003|T1018|T1542.005|T1197|T1566.001|T1190|T1566.002|T1199|T1189|T1204.001|T1047|T1110.004|T1110.003|T1003.006|T1558.003|T1207|T1218.003|T1567|T1020|T1048|T1030|T1029|T1048.001|T1041|T1567.002|T1048.003|T1011|T1048.002|T1567.001,https://d3fend.mitre.org/technique/d3f:Client-serverPayloadProfiling/,d3fend
D3-CTS,Credential Transmission Scoping,Isolate,Limiting the transmission of a credential to a scoped set of relying parties.,,T1550.001|T1550.004|T1134.001|T1098.001|T1134.002|T1134.003|T1110.001|T1003.003|T1558.001|T1558|T1003.008|T1528|T1003.005|T1110.003|T1539|T1142|T1552|T1110.002|T1606|T1606.001,https://d3fend.mitre.org/technique/d3f:CredentialTransmissionScoping/,d3fend
D3-CV,Content Validation,,Verify and validate contents complies with policy,,,https://d3fend.mitre.org/technique/d3f:ContentValidation/,d3fend
D3-DA,Dynamic Analysis,Detect,"Executing or opening a file in a synthetic ""sandbox"" environment to determine if the file is a malicious program or if the file exploits another program such as a document reader.",DocumentFile|ExecutableFile,T1534|T1548.002|T1546.002|T1055.003|T1546.015|T1574.009|T1547.009|T1547.001|T1546.006|T1546.008|T1037.004|T1037.002|T1574.007|T1037.003|T1546.013|T1546.005|T1037.001|T1574.008|T1565.003|T1114.001|T1016|T1137.001|T1505.003|T1137.003|T1566.001|T1566.002|T1204.002|T1059|T1218.005|T1027.004|T1027.002|T1140|T1562.003|T1036.001|T1220|T1036.003|T1027.001|T1564.007,https://d3fend.mitre.org/technique/d3f:DynamicAnalysis/,d3fend
D3-DAM,Domain Account Monitoring,Detect,Monitoring the existence of or changes to Domain User Accounts.,,T1098.002|T1078.002|T1098.003|T1087.002|T1136.002,https://d3fend.mitre.org/technique/d3f:DomainAccountMonitoring/,d3fend
D3-DCE,Dead Code Elimination,,"Removing unreachable or ""dead code"" from compiled source code.",,,https://d3fend.mitre.org/technique/d3f:DeadCodeElimination/,d3fend
D3-DE,Decoy Environment,Deceive,A Decoy Environment comprises hosts and networks for the purposes of deceiving an attacker.,Deceive,T1082,https://d3fend.mitre.org/technique/d3f:DecoyEnvironment/,d3fend
D3-DEM,Data Exchange Mapping,,"Data exchange mapping identifies and models the organization's intended design for the flows of the data types, formats, and volumes between systems at the application layer.",,,https://d3fend.mitre.org/technique/d3f:DataExchangeMapping/,d3fend
D3-DENCR,Disk Encryption,Harden,Encrypting a hard disk partition to prevent cleartext access to a file system.,,T1619|T1564.005,https://d3fend.mitre.org/technique/d3f:DiskEncryption/,d3fend
D3-DF,Decoy File,Deceive,A file created for the purposes of deceiving an adversary.,,T1072|T1534|T1548.002|T1055.014|T1547.006|T1546.004|T1546.002|T1574.002|T1055.003|T1547.007|T1546.015|T1574.004|T1546.010|T1543.004|T1574.012|T1053.004|T1055.002|T1574.009|T1547.011|T1546.014|T1547.009|T1547.001|T1546.006|T1547.008|T1546.008|T1055.009|T1574.001|T1037.004|T1037.002|T1574.007|T1037.003|T1548.003|T1543.001|T1546.013|T1055.001|T1546.005|T1037.001|T1574.006|T1546.009|T1574.008|T1543.002|T1573.002|T1071.001|T1071|T1486|T1565.001|T1565.003|T1119|T1074.001|T1560.003|T1005|T1560|T1560.002|T1560.001|T1114.001|T1016|T1018|T1033|T1083|T1137.001|T1556.002|T1505.003|T1137.003|T1556.003|T1566.001|T1566.002|T1566.003|T1204.002|T1059|T1552.001|T1003.008|T1187|T1555|T1555.003|T1003.007|T1649|T1552.003|T1070.002|T1036.006|T1218.005|T1027.004|T1564.006|T1127.001|T1027.002|T1218.011|T1564.003|T1140|T1014|T1562.003|T1036.001|T1220|T1070.004|T1036.003|T1036.005|T1027.001|T1564.007|T1564.002|T1041|T1048.002,https://d3fend.mitre.org/technique/d3f:DecoyFile/,d3fend
D3-DI,Data Inventory,Model,"Data inventorying identifies and records the schemas, formats, volumes, and locations of data stored and used on the organization's architecture.",,T1534|T1546.012|T1548.004|T1543.003|T1546.015|T1213.003|T1114.001|T1614.001|T1033|T1012|T1137.006|T1137.003|T1112|T1566.001|T1566.002|T1555.001|T1003.008|T1552.002|T1555|T1555.003|T1003.004|T1555.002|T1003.002|T1218.005|T1218.014|T1564.003|T1207|T1564.005|T1564.007,https://d3fend.mitre.org/technique/d3f:DataInventory/,d3fend
D3-DKE,Disk Erasure,Evict,Disk Erasure is the process of securely deleting all data on a disk to ensure that it cannot be recovered by any means.,,T1619,https://d3fend.mitre.org/technique/d3f:DiskErasure/,d3fend
D3-DKF,Disk Formatting,Evict,"Disk Formatting is the process of preparing a data storage device, such as a hard drive, solid-state drive, or USB flash drive, for initial use.",,T1619,https://d3fend.mitre.org/technique/d3f:DiskFormatting/,d3fend
D3-DKP,Disk Partitioning,Evict,"Disk Partitioning is the process of dividing a disk into multiple distinct sections, known as partitions.",,T1561.002|T1561.001,https://d3fend.mitre.org/technique/d3f:DiskPartitioning/,d3fend
D3-DLIC,Driver Load Integrity Checking,,Ensuring the integrity of drivers loaded during initialization of the operating system.,,,https://d3fend.mitre.org/technique/d3f:DriverLoadIntegrityChecking/,d3fend
D3-DLV,Domain Logic Validation,Harden,Validation of variable state in the context of the domain application.,,T1505.001,https://d3fend.mitre.org/technique/d3f:DomainLogicValidation/,d3fend
D3-DNL,Directional Network Link,,Enforce one-way network communication by preventing two-way communication.,,,https://d3fend.mitre.org/technique/d3f:DirectionalNetworkLink/,d3fend
D3-DNR,Decoy Network Resource,Deceive,Deploying a network resource for the purposes of deceiving an adversary.,,T1080|T1037.003|T1491.002|T1039|T1074.002|T1213.002|T1213.001|T1070.005,https://d3fend.mitre.org/technique/d3f:DecoyNetworkResource/,d3fend
D3-DNRA,Domain Name Reputation Analysis,,Analyzing the reputation of a domain name.,DomainName,,https://d3fend.mitre.org/technique/d3f:DomainNameReputationAnalysis/,d3fend
D3-DNSAL,DNS Allowlisting,Isolate,Permitting only approved domains and their subdomains to be resolved.,,T1071.004|T1568,https://d3fend.mitre.org/technique/d3f:DNSAllowlisting/,d3fend
D3-DNSCE,DNS Cache Eviction,,Flushing DNS to clear any IP addresses or other DNS records from the cache.,,,https://d3fend.mitre.org/technique/d3f:DNSCacheEviction/,d3fend
D3-DNSDL,DNS Denylisting,Isolate,"Blocking DNS Network Traffic based on criteria such as IP address, domain name, or DNS query type.",,T1071.004|T1568,https://d3fend.mitre.org/technique/d3f:DNSDenylisting/,d3fend
D3-DNSTA,DNS Traffic Analysis,Detect,"Analysis of domain name metadata, including name and DNS records, to determine whether the domain is likely to resolve to an undesirable host.",OutboundInternetDNSLookupTraffic,T1071.004|T1568|T1040,https://d3fend.mitre.org/technique/d3f:DNSTrafficAnalysis/,d3fend
D3-DO,Decoy Object,,A Decoy Object is created and deployed for the purposes of deceiving attackers.,Deceive,,https://d3fend.mitre.org/technique/d3f:DecoyObject/,d3fend
